{
  "schema_version": "intent.v1",
  "intent_id": "intent-1",
  "revision": 1,
  "input_revision_ref": "fixture:input-1@1",
  "registry_version": "1",
  "template_version": "1",
  "canonicalizer_version": "1",
  "capability_ref": "fixture:send",
  "scope": {
    "grant_ref": "fixture:grant",
    "scope_digest": "0000000000000000000000000000000000000000000000000000000000000000",
    "effect_kind": "AI_MESSAGE",
    "repo_ref": "fixture:repo",
    "target_binding_ref": "fixture:binding"
  },
  "slots": {
    "repo": {
      "status": "RESOLVED",
      "value": "fixture:value",
      "provenance_ref": "fixture:input1"
    },
    "destination": {
      "status": "RESOLVED",
      "value": "fixture:value",
      "provenance_ref": "fixture:input1"
    },
    "effect": {
      "status": "RESOLVED",
      "value": "fixture:value",
      "provenance_ref": "fixture:input1"
    },
    "amount": {
      "status": "RESOLVED",
      "value": "fixture:value",
      "provenance_ref": "fixture:input1"
    },
    "path": {
      "status": "RESOLVED",
      "value": "fixture:value",
      "provenance_ref": "fixture:input1"
    },
    "mode": {
      "status": "RESOLVED",
      "value": "fixture:value",
      "provenance_ref": "fixture:input1"
    }
  },
  "source_snapshot_refs": [
    "fixture:source-v1"
  ],
  "output_criteria": [
    "all part IDs accounted"
  ],
  "state": "PROPOSED"
}
